{
  "subsystem_genome_version": "subsystem_genome.v1",
  "identity": {
    "gene": "blueprint_posture_organ",
    "version": "0.1.0-concept",
    "stage": "governed",
    "display_name": "Blueprint Posture Subsystem"
  },
  "governance": {
    "contracts": [
      "docs/contracts/AAIS_SSP_PROTOCOL.md",
      "docs/contracts/AAIS_SSP_PROMOTION_PROTOCOL.md",
      "docs/contracts/AAIS_SUBSYSTEM_GENOME.md",
      "docs/runtime/AAIS_RUNTIME_GUIDE.md",
      "docs/contracts/JARVIS_PROTOCOL.md",
      "docs/contracts/AAIS_SUBSYSTEM_MUTATION_PATH.md",
      "docs/contracts/AAIS_SUBSYSTEM_RETIREMENT_PROTOCOL.md"
    ],
    "invariants": [
      "Read-only v1 \u2014 subsystem does not mutate upstream authority",
      "module_id frozen to AAIS-BPP-01"
    ]
  },
  "schema": {
    "ref": "schemas/blueprint_posture_organ.v1.json",
    "frozen": true
  },
  "runtime": {
    "surface": [
      {
        "kind": "module",
        "path": "src/blueprint_posture_organ.py"
      },
      {
        "kind": "api",
        "path": "GET /api/jarvis/blueprint-posture/status"
      },
      {
        "kind": "gate",
        "path": "make blueprint-posture-organ-gate"
      }
    ]
  },
  "proof": {
    "bundles": [
      "docs/proof/platform/BLUEPRINT_POSTURE_ORGAN_GOVERNED_PROOF.md"
    ],
    "posture": "governed",
    "target_bundles": [
      "docs/proof/platform/BLUEPRINT_POSTURE_ORGAN_V1_PROOF.md"
    ]
  },
  "lineage": {
    "parents": [
      "project_infi_law_organ",
      "aais_ul_substrate_organ"
    ],
    "children": []
  },
  "activation": {
    "order": 5,
    "batch_id": "alt20-summon-wave-2026-06",
    "notes": "Release 20 wave 5"
  },
  "retirement": {
    "path": "docs/contracts/AAIS_SUBSYSTEM_RETIREMENT_PROTOCOL.md"
  },
  "mutation": {
    "history": []
  },
  "ssp": {
    "concept_spec": "docs/_future/ideas_pending/BLUEPRINT_POSTURE_ORGAN.md",
    "mvp_plan": "docs/_future/ideas_pending/BLUEPRINT_POSTURE_ORGAN_MVP_PLAN.md",
    "summon_eligible": false,
    "active_doc": "docs/subsystems/platform/BLUEPRINT_POSTURE_ORGAN.md",
    "engineering_class": "BlueprintPostureEngine",
    "mythic_label": "Blueprint Posture Organ",
    "linguistic_version": "1.0.0"
  }
}
