{
  "subsystem_genome_version": "subsystem_genome.v1",
  "identity": {
    "gene": "world_pack_lane_organ",
    "version": "1.0.0-mvp",
    "stage": "mvp",
    "display_name": "World Pack Lane"
  },
  "governance": {
    "contracts": [
      "docs/contracts/AAIS_SSP_PROTOCOL.md",
      "docs/contracts/AAIS_SSP_PROMOTION_PROTOCOL.md",
      "docs/contracts/AAIS_SUBSYSTEM_GENOME.md",
      "docs/contracts/AAIS_META_LINGUISTIC_GOVERNANCE.md",
      "docs/contracts/AAIS_CODEX_CURSOR_NAMING_PROTOCOL.md",
      "docs/runtime/AAIS_RUNTIME_GUIDE.md",
      "docs/subsystems/storyforge/STORYFORGE_CANONICAL.md"
    ],
    "invariants": [
      "Read-only v1 \u2014 organ does not mutate upstream authority",
      "module_id frozen per Release 28"
    ]
  },
  "schema": {
    "ref": "schemas/world_pack_lane_organ.v1.json",
    "frozen": false
  },
  "runtime": {
    "surface": [
      {
        "kind": "module",
        "path": "src/world_pack_lane_organ.py"
      },
      {
        "kind": "api",
        "path": "GET /api/jarvis/world-pack-lane/status"
      },
      {
        "kind": "gate",
        "path": "make world-pack-lane-organ-gate"
      }
    ]
  },
  "proof": {
    "bundles": [
      "docs/proof/storyforge/WORLD_PACK_LANE_ORGAN_V1_PROOF.md"
    ],
    "posture": "asserted",
    "target_bundles": [
      "docs/proof/storyforge/WORLD_PACK_LANE_ORGAN_V1_PROOF.md"
    ]
  },
  "lineage": {
    "parents": [
      "text_to_3d_world_lane_organ",
      "story_forge_lane_organ"
    ],
    "children": []
  },
  "activation": {
    "order": 6,
    "batch_id": "alt28-summon-wave-2026-06",
    "notes": "Release 28 wave 6"
  },
  "retirement": {
    "path": "docs/contracts/AAIS_SUBSYSTEM_RETIREMENT_PROTOCOL.md"
  },
  "mutation": {
    "history": []
  },
  "ssp": {
    "concept_spec": "docs/_future/ideas_pending/WORLD_PACK_LANE_ORGAN.md",
    "mvp_plan": "docs/_future/ideas_pending/WORLD_PACK_LANE_ORGAN_MVP_PLAN.md",
    "summon_eligible": false,
    "active_doc": "docs/subsystems/storyforge/WORLD_PACK_LANE.md"
  }
}
