{
  "subsystem_genome_version": "subsystem_genome.v1",
  "identity": {
    "gene": "meta_linguistic_governance_organ",
    "version": "0.1.0-concept",
    "stage": "governed",
    "display_name": "Meta-Linguistic Governance Subsystem"
  },
  "governance": {
    "contracts": [
      "docs/contracts/AAIS_SSP_PROTOCOL.md",
      "docs/contracts/AAIS_SSP_PROMOTION_PROTOCOL.md",
      "docs/contracts/AAIS_SUBSYSTEM_GENOME.md",
      "docs/contracts/AAIS_META_LINGUISTIC_GOVERNANCE.md",
      "docs/contracts/AAIS_CODEX_CURSOR_NAMING_PROTOCOL.md",
      "docs/runtime/AAIS_RUNTIME_GUIDE.md",
      "docs/contracts/AAIS_SUBSYSTEM_MUTATION_PATH.md",
      "docs/contracts/AAIS_SUBSYSTEM_RETIREMENT_PROTOCOL.md"
    ],
    "invariants": [
      "Read-only v1 \u2014 subsystem does not mutate upstream authority",
      "module_id frozen to AAIS-MLG-01"
    ]
  },
  "schema": {
    "ref": "schemas/meta_linguistic_governance_organ.v1.json",
    "frozen": true
  },
  "runtime": {
    "surface": [
      {
        "kind": "module",
        "path": "src/meta_linguistic_governance_organ.py"
      },
      {
        "kind": "api",
        "path": "GET /api/jarvis/meta-linguistic-governance/status"
      },
      {
        "kind": "gate",
        "path": "make meta-linguistic-governance-organ-gate"
      }
    ]
  },
  "proof": {
    "bundles": [
      "E:\\project-infi\\docs\\proof\\platform\\META_LINGUISTIC_GOVERNANCE_ORGAN_GOVERNED_PROOF.md"
    ],
    "posture": "governed",
    "target_bundles": [
      "docs/proof/platform/META_LINGUISTIC_GOVERNANCE_ORGAN_V1_PROOF.md"
    ]
  },
  "lineage": {
    "parents": [
      "naming_protocol_organ",
      "naming_genome_organ",
      "linguistic_mutation_organ",
      "linguistic_remediation_organ",
      "linguistic_cascade_organ",
      "governance_layer_organ"
    ],
    "children": [
      "linguistic_drift_forecast_organ",
      "linguistic_drift_report_organ",
      "linguistic_forecast_calibration_organ",
      "linguistic_governance_cycle_organ",
      "linguistic_subsystem_promotion_organ",
      "meta_linguistic_registry_organ"
    ]
  },
  "activation": {
    "order": 9,
    "batch_id": "alt22-summon-wave-2026-06",
    "notes": "Release 22 wave 9"
  },
  "retirement": {
    "path": "docs/contracts/AAIS_SUBSYSTEM_RETIREMENT_PROTOCOL.md"
  },
  "mutation": {
    "history": []
  },
  "ssp": {
    "concept_spec": "docs/_future/ideas_pending/META_LINGUISTIC_GOVERNANCE_ORGAN.md",
    "mvp_plan": "docs/_future/ideas_pending/META_LINGUISTIC_GOVERNANCE_ORGAN_MVP_PLAN.md",
    "summon_eligible": false,
    "active_doc": "docs/subsystems/platform/META_LINGUISTIC_GOVERNANCE_ORGAN.md",
    "engineering_class": "MetaLinguisticGovernanceEngine",
    "mythic_label": "Meta Linguistic Governance Organ",
    "linguistic_version": "1.0.0"
  }
}
