{
  "subsystem_genome_version": "subsystem_genome.v1",
  "identity": {
    "gene": "conversation_memory_organ",
    "version": "0.1.0-concept",
    "stage": "governed",
    "display_name": "Conversation Memory Organ"
  },
  "governance": {
    "contracts": [
      "docs/contracts/AAIS_SSP_PROTOCOL.md",
      "docs/contracts/AAIS_SSP_PROMOTION_PROTOCOL.md",
      "docs/contracts/AAIS_SUBSYSTEM_GENOME.md",
      "docs/runtime/AAIS_RUNTIME_GUIDE.md",
      "docs/contracts/JARVIS_PROTOCOL.md",
      "docs/contracts/AAIS_SUBSYSTEM_MUTATION_PATH.md",
      "docs/contracts/AAIS_SUBSYSTEM_RETIREMENT_PROTOCOL.md"
    ],
    "invariants": [
      "Read-only v1 \u2014 organ does not mutate upstream authority",
      "module_id frozen to AAIS-CMO-01"
    ]
  },
  "schema": {
    "ref": "schemas/conversation_memory_organ.v1.json",
    "frozen": true
  },
  "runtime": {
    "surface": [
      {
        "kind": "module",
        "path": "src/conversation_memory_organ.py"
      },
      {
        "kind": "api",
        "path": "GET /api/jarvis/conversation-memory/status"
      },
      {
        "kind": "gate",
        "path": "make conversation-memory-organ-gate"
      }
    ]
  },
  "proof": {
    "bundles": [
      "E:\\project-infi\\docs\\proof\\platform\\CONVERSATION_MEMORY_ORGAN_GOVERNED_PROOF.md"
    ],
    "posture": "governed",
    "target_bundles": [
      "docs/proof/platform/CONVERSATION_MEMORY_ORGAN_V1_PROOF.md"
    ]
  },
  "lineage": {
    "parents": [
      "jarvis_memory_board",
      "jarvis_protocol_organ"
    ],
    "children": [
      "continuity_substrate_organ",
      "prompt_assembly_organ"
    ]
  },
  "activation": {
    "order": 4,
    "batch_id": "alt17-summon-wave-2026-06",
    "notes": "Alt-17 wave 4"
  },
  "retirement": {
    "path": "docs/contracts/AAIS_SUBSYSTEM_RETIREMENT_PROTOCOL.md"
  },
  "mutation": {
    "history": []
  },
  "ssp": {
    "concept_spec": "docs/_future/ideas_pending/CONVERSATION_MEMORY_ORGAN.md",
    "mvp_plan": "docs/_future/ideas_pending/CONVERSATION_MEMORY_ORGAN_MVP_PLAN.md",
    "summon_eligible": false,
    "active_doc": "docs/subsystems/platform/CONVERSATION_MEMORY_ORGAN.md"
  }
}
