{
  "subsystem_genome_version": "subsystem_genome.v1",
  "identity": {
    "gene": "aais_composed_runtime_organ",
    "version": "0.1.0-concept",
    "stage": "governed",
    "display_name": "AAIS Composed Runtime Organ"
  },
  "governance": {
    "contracts": [
      "docs/contracts/AAIS_SSP_PROTOCOL.md",
      "docs/contracts/AAIS_SSP_PROMOTION_PROTOCOL.md",
      "docs/contracts/AAIS_SUBSYSTEM_GENOME.md",
      "docs/runtime/AAIS_RUNTIME_GUIDE.md",
      "docs/contracts/JARVIS_PROTOCOL.md",
      "docs/contracts/AAIS_SUBSYSTEM_MUTATION_PATH.md",
      "docs/contracts/AAIS_SUBSYSTEM_RETIREMENT_PROTOCOL.md"
    ],
    "invariants": [
      "Read-only v1 \u2014 organ does not mutate upstream authority",
      "module_id frozen to AAIS-ACR-01"
    ]
  },
  "schema": {
    "ref": "schemas/aais_composed_runtime_organ.v1.json",
    "frozen": true
  },
  "runtime": {
    "surface": [
      {
        "kind": "module",
        "path": "src/aais_composed_runtime_organ.py"
      },
      {
        "kind": "api",
        "path": "GET /api/jarvis/aais-composed-runtime/status"
      },
      {
        "kind": "gate",
        "path": "make aais-composed-runtime-organ-gate"
      }
    ]
  },
  "proof": {
    "bundles": [
      "docs/proof/platform/AAIS_COMPOSED_RUNTIME_ORGAN_GOVERNED_PROOF.md"
    ],
    "posture": "governed",
    "target_bundles": [
      "docs/proof/platform/AAIS_COMPOSED_RUNTIME_ORGAN_V1_PROOF.md"
    ]
  },
  "lineage": {
    "parents": [
      "jarvis_operator_organ",
      "governance_layer_organ"
    ],
    "children": []
  },
  "activation": {
    "order": 8,
    "batch_id": "alt19-summon-wave-2026-06",
    "notes": "Alt-19 wave 8"
  },
  "retirement": {
    "path": "docs/contracts/AAIS_SUBSYSTEM_RETIREMENT_PROTOCOL.md"
  },
  "mutation": {
    "history": []
  },
  "ssp": {
    "concept_spec": "docs/_future/ideas_pending/AAIS_COMPOSED_RUNTIME_ORGAN.md",
    "mvp_plan": "docs/_future/ideas_pending/AAIS_COMPOSED_RUNTIME_ORGAN_MVP_PLAN.md",
    "summon_eligible": false,
    "active_doc": "docs/subsystems/platform/AAIS_COMPOSED_RUNTIME_ORGAN.md",
    "engineering_class": "AaisComposedRuntimeEngine",
    "mythic_label": "Aais Composed Runtime Organ",
    "linguistic_version": "1.0.0"
  }
}
