{
  "subsystem_genome_version": "subsystem_genome.v1",
  "identity": {
    "gene": "governed_event_chain_organ",
    "version": "0.1.0-concept",
    "stage": "governed",
    "display_name": "Governed Event Chain Organ"
  },
  "governance": {
    "contracts": [
      "docs/contracts/AAIS_SSP_PROTOCOL.md",
      "docs/contracts/AAIS_SSP_PROMOTION_PROTOCOL.md",
      "docs/contracts/AAIS_SUBSYSTEM_GENOME.md",
      "docs/contracts/AAIS_SUBSYSTEM_MUTATION_PATH.md",
      "docs/contracts/AAIS_SUBSYSTEM_RETIREMENT_PROTOCOL.md"
    ],
    "invariants": [
      "Read-only v1 \u2014 organ does not mutate upstream authority",
      "module_id frozen to AAIS-GEC-01"
    ]
  },
  "schema": {
    "ref": "schemas/governed_event_chain_organ.v1.json",
    "frozen": true
  },
  "runtime": {
    "surface": [
      {
        "kind": "module",
        "path": "src/governed_event_chain_organ.py"
      },
      {
        "kind": "api",
        "path": "GET /api/jarvis/governed-event-chain/status"
      },
      {
        "kind": "gate",
        "path": "make governed-event-chain-organ-gate"
      }
    ]
  },
  "proof": {
    "bundles": [
      "docs/proof/platform/GOVERNED_EVENT_CHAIN_ORGAN_GOVERNED_PROOF.md"
    ],
    "posture": "governed",
    "target_bundles": [
      "docs/proof/platform/GOVERNED_EVENT_CHAIN_ORGAN_V1_PROOF.md"
    ]
  },
  "lineage": {
    "parents": [
      "cognitive_bridge_organ",
      "phase_gate_organ",
      "realtime_event_cause_predictor_organ"
    ],
    "children": [
      "tracing_spine_organ"
    ]
  },
  "activation": {
    "order": 2,
    "batch_id": "alt11-summon-wave-2026-06",
    "notes": "Alt-11 wave 2"
  },
  "retirement": {
    "path": "docs/contracts/AAIS_SUBSYSTEM_RETIREMENT_PROTOCOL.md"
  },
  "mutation": {
    "history": []
  },
  "ssp": {
    "concept_spec": "docs/_future/ideas_pending/GOVERNED_EVENT_CHAIN_ORGAN.md",
    "mvp_plan": "docs/_future/ideas_pending/GOVERNED_EVENT_CHAIN_ORGAN_MVP_PLAN.md",
    "summon_eligible": false,
    "active_doc": "docs/subsystems/platform/GOVERNED_EVENT_CHAIN_ORGAN.md",
    "engineering_class": "GovernedEventChainEngine",
    "mythic_label": "Governed Event Chain Organ",
    "linguistic_version": "1.0.0"
  }
}
