{
  "subsystem_genome_version": "subsystem_genome.v1",
  "identity": {
    "gene": "memory_smith_organ",
    "version": "0.1.0-concept",
    "stage": "governed",
    "display_name": "Memory Smith Subsystem"
  },
  "governance": {
    "contracts": [
      "docs/contracts/AAIS_SSP_PROTOCOL.md",
      "docs/contracts/AAIS_SSP_PROMOTION_PROTOCOL.md",
      "docs/contracts/AAIS_SUBSYSTEM_GENOME.md",
      "docs/runtime/AAIS_RUNTIME_GUIDE.md",
      "docs/contracts/JARVIS_PROTOCOL.md",
      "docs/contracts/AAIS_SUBSYSTEM_MUTATION_PATH.md",
      "docs/contracts/AAIS_SUBSYSTEM_RETIREMENT_PROTOCOL.md"
    ],
    "invariants": [
      "Read-only v1 \u2014 subsystem does not mutate upstream authority",
      "module_id frozen to AAIS-MSM-01"
    ]
  },
  "schema": {
    "ref": "schemas/memory_smith_organ.v1.json",
    "frozen": true
  },
  "runtime": {
    "surface": [
      {
        "kind": "module",
        "path": "src/memory_smith_organ.py"
      },
      {
        "kind": "api",
        "path": "GET /api/jarvis/memory-smith/status"
      },
      {
        "kind": "gate",
        "path": "make memory-smith-organ-gate"
      }
    ]
  },
  "proof": {
    "bundles": [
      "docs/proof/platform/MEMORY_SMITH_ORGAN_V1_PROOF.md"
    ],
    "posture": "governed",
    "target_bundles": [
      "docs/proof/platform/MEMORY_SMITH_ORGAN_V1_PROOF.md"
    ]
  },
  "lineage": {
    "parents": [
      "jarvis_memory_board",
      "memory_path_governance_organ"
    ],
    "children": []
  },
  "activation": {
    "order": 1,
    "batch_id": "alt20-summon-wave-2026-06",
    "notes": "Release 20 wave 1"
  },
  "retirement": {
    "path": "docs/contracts/AAIS_SUBSYSTEM_RETIREMENT_PROTOCOL.md"
  },
  "mutation": {
    "history": []
  },
  "ssp": {
    "concept_spec": "docs/_future/ideas_pending/MEMORY_SMITH_ORGAN.md",
    "mvp_plan": "docs/_future/ideas_pending/MEMORY_SMITH_ORGAN_MVP_PLAN.md",
    "summon_eligible": false,
    "active_doc": "docs/subsystems/platform/MEMORY_SMITH_ORGAN.md"
  }
}
