{
  "subsystem_genome_version": "subsystem_genome.v1",
  "identity": {
    "gene": "planning_organ",
    "version": "0.1.0-concept",
    "stage": "governed",
    "display_name": "Planning Organ"
  },
  "governance": {
    "contracts": [
      "docs/contracts/AAIS_SSP_PROTOCOL.md",
      "docs/contracts/AAIS_SSP_PROMOTION_PROTOCOL.md",
      "docs/contracts/AAIS_SUBSYSTEM_GENOME.md",
      "docs/runtime/NOVA_CORTEX.md",
      "docs/contracts/AAIS_SUBSYSTEM_MUTATION_PATH.md",
      "docs/contracts/AAIS_SUBSYSTEM_RETIREMENT_PROTOCOL.md"
    ],
    "invariants": [
      "Read-only v1 \u2014 organ does not mutate upstream authority",
      "module_id frozen to AAIS-PLO-02"
    ]
  },
  "schema": {
    "ref": "schemas/planning_organ.v1.json",
    "frozen": true
  },
  "runtime": {
    "surface": [
      {
        "kind": "module",
        "path": "src/planning_organ.py"
      },
      {
        "kind": "api",
        "path": "GET /api/jarvis/planning/status"
      },
      {
        "kind": "gate",
        "path": "make planning-organ-gate"
      }
    ]
  },
  "proof": {
    "bundles": [
      "docs/proof/nova/PLANNING_ORGAN_GOVERNED_PROOF.md"
    ],
    "posture": "governed",
    "target_bundles": [
      "docs/proof/cognitive_runtime/PLANNING_ORGAN_V1_PROOF.md"
    ]
  },
  "lineage": {
    "parents": [
      "deliberation_organ",
      "reflection_runtime_organ"
    ],
    "children": [
      "cognitive_execution_organ",
      "cortex_arcs_organ"
    ]
  },
  "activation": {
    "order": 5,
    "batch_id": "alt15-summon-wave-2026-06",
    "notes": "Alt-15 wave 5"
  },
  "retirement": {
    "path": "docs/contracts/AAIS_SUBSYSTEM_RETIREMENT_PROTOCOL.md"
  },
  "mutation": {
    "history": []
  },
  "ssp": {
    "concept_spec": "docs/_future/ideas_pending/PLANNING_ORGAN.md",
    "mvp_plan": "docs/_future/ideas_pending/PLANNING_ORGAN_MVP_PLAN.md",
    "summon_eligible": false,
    "active_doc": "docs/subsystems/nova/PLANNING_ORGAN.md",
    "engineering_class": "PlanningEngine",
    "mythic_label": "Planning Organ",
    "linguistic_version": "1.0.0"
  }
}
