{
  "subsystem_genome_version": "subsystem_genome.v1",
  "identity": {
    "gene": "operator_profile_organ",
    "version": "1.0.1",
    "stage": "governed",
    "display_name": "Operator Profile Organ"
  },
  "governance": {
    "contracts": [
      "docs/contracts/AAIS_SSP_PROTOCOL.md",
      "docs/contracts/AAIS_SSP_PROMOTION_PROTOCOL.md",
      "docs/contracts/AAIS_SUBSYSTEM_GENOME.md",
      "docs/contracts/AAIS_ADAPTIVE_GOVERNANCE.md",
      "docs/contracts/AAIS_SUBSYSTEM_MUTATION_PATH.md",
      "docs/contracts/AAIS_SUBSYSTEM_RETIREMENT_PROTOCOL.md"
    ],
    "invariants": [
      "profile_id never empty on live path",
      "authority_lane defaults to operator",
      "No elevation without explicit operator action",
      "Profile authority changes require MP-X and post-apply alt7-governed-gate"
    ],
    "operator_lanes": [
      {
        "lane_id": "operator",
        "weight": 1.0,
        "capabilities": [
          "inspect_operator_profile",
          "resolve_authority_lane"
        ]
      }
    ]
  },
  "schema": {
    "ref": "schemas/operator_profile_organ.v1.json",
    "frozen": true
  },
  "runtime": {
    "surface": [
      {
        "kind": "module",
        "path": "src/operator_profile_organ.py"
      },
      {
        "kind": "api",
        "path": "GET /api/jarvis/operator-profile"
      },
      {
        "kind": "gate",
        "path": "make operator-profile-gate"
      }
    ]
  },
  "proof": {
    "bundles": [
      "docs/proof/platform/OPERATOR_PROFILE_V1_PROOF.md"
    ],
    "posture": "governed",
    "target_bundles": [
      "docs/proof/platform/OPERATOR_PROFILE_V1_PROOF.md"
    ]
  },
  "lineage": {
    "parents": [
      "jarvis",
      "knowledge_authority"
    ],
    "children": [
      "adaptive_lane_organ",
      "cognitive_bridge_organ",
      "direct_challenge_organ",
      "knowledge_authority_organ",
      "nova_face_organ",
      "operator_cognition_coherence_fabric",
      "otem_bounded_organ",
      "reasoning_executive_organ",
      "reflection_runtime_organ",
      "ul_lineage_console_organ"
    ]
  },
  "activation": {
    "order": 2,
    "batch_id": "alt5-summon-wave-2026-06",
    "notes": "Alt-5 wave 2 \u2014 operator identity lane"
  },
  "retirement": {
    "path": "docs/contracts/AAIS_SUBSYSTEM_RETIREMENT_PROTOCOL.md"
  },
  "mutation": {
    "history": [
      {
        "proposal_id": "MP-OPO-001",
        "status": "promoted",
        "schema_delta_ref": "schemas/deltas/operator_profile_organ_MP-OPO-001.json",
        "notes": "backup: .runtime\\governance\\mutation_backups\\operator_profile_organ_20260603T000012Z.genome.v1.json"
      }
    ]
  },
  "ssp": {
    "concept_spec": "docs/_future/ideas_pending/OPERATOR_PROFILE_ORGAN.md",
    "mvp_plan": "docs/_future/ideas_pending/OPERATOR_PROFILE_ORGAN_MVP_PLAN.md",
    "active_doc": "docs/subsystems/platform/OPERATOR_PROFILE_ORGAN.md",
    "summon_eligible": false,
    "engineering_class": "OperatorProfileEngine",
    "mythic_label": "Operator Profile Organ",
    "linguistic_version": "1.0.0"
  }
}
