{
  "subsystem_genome_version": "subsystem_genome.v1",
  "identity": {
    "gene": "capability_service_bridge",
    "version": "0.1.0-concept",
    "stage": "governed",
    "display_name": "Capability Service Bridge"
  },
  "governance": {
    "contracts": [
      "docs/contracts/AAIS_SSP_PROTOCOL.md",
      "docs/contracts/AAIS_SSP_PROMOTION_PROTOCOL.md",
      "docs/contracts/AAIS_SUBSYSTEM_GENOME.md",
      "docs/contracts/AAIS_MODULE_GOVERNANCE_PROTOCOL.md",
      "docs/contracts/AAIS_ADAPTIVE_GOVERNANCE.md",
      "docs/contracts/AAIS_SUBSYSTEM_MUTATION_PATH.md",
      "docs/contracts/AAIS_SUBSYSTEM_RETIREMENT_PROTOCOL.md"
    ],
    "invariants": [
      "Unregistered capability execute paths return blocked outcome when bridge is authoritative",
      "governance_mode is explicit in every exported bridge snapshot",
      "Phase violations surface auditable phase events without silent continue"
    ],
    "operator_lanes": [
      {
        "lane_id": "operator",
        "weight": 1.0,
        "capabilities": [
          "execute_capability",
          "inspect_bridge_status"
        ]
      }
    ]
  },
  "schema": {
    "ref": "schemas/capability_service_bridge.v1.json",
    "frozen": true
  },
  "runtime": {
    "surface": [
      {
        "kind": "module",
        "path": "src/capability_service_bridge.py"
      },
      {
        "kind": "api",
        "path": "GET /api/jarvis/capability-bridge"
      },
      {
        "kind": "api",
        "path": "GET /api/jarvis/capability-bridge/status"
      },
      {
        "kind": "gate",
        "path": "make capability-bridge-gate"
      }
    ]
  },
  "proof": {
    "bundles": [
      "docs/proof/platform/CAPABILITY_SERVICE_BRIDGE_V1_PROOF.md"
    ],
    "posture": "governed",
    "target_bundles": [
      "docs/proof/platform/CAPABILITY_SERVICE_BRIDGE_V1_PROOF.md"
    ]
  },
  "lineage": {
    "parents": [],
    "children": [
      "adaptive_lane_organ",
      "ai_factory_organ",
      "api_gateway_organ",
      "capability_module_organ",
      "cisiv_operator_lineage_console",
      "cogos_runtime_bridge_organ",
      "document_vision_organ",
      "forge_contractor_organ",
      "governed_direct_pipeline",
      "jarvis_protocol_organ",
      "launcher_organ",
      "mechanic_handoff_organ",
      "operator_cognition_coherence_fabric",
      "operator_workspace_organ",
      "phase_gate_organ",
      "story_forge_lane_organ",
      "verification_gate_organ",
      "workflow_shell_organ"
    ]
  },
  "activation": {
    "order": 1,
    "batch_id": "barebones-summon-wave-2026-06",
    "notes": "Barebones wave \u2014 execution governance fabric"
  },
  "retirement": {
    "path": "docs/contracts/AAIS_SUBSYSTEM_RETIREMENT_PROTOCOL.md"
  },
  "mutation": {
    "history": []
  },
  "ssp": {
    "concept_spec": "docs/_future/ideas_pending/CAPABILITY_SERVICE_BRIDGE.md",
    "mvp_plan": "docs/_future/ideas_pending/CAPABILITY_SERVICE_BRIDGE_MVP_PLAN.md",
    "summon_eligible": false,
    "active_doc": "docs/subsystems/platform/CAPABILITY_SERVICE_BRIDGE.md"
  }
}
