{
  "subsystem_genome_version": "subsystem_genome.v1",
  "identity": {
    "gene": "speakers_lane_organ",
    "version": "0.1.0-concept",
    "stage": "governed",
    "display_name": "Speakers Lane Organ"
  },
  "governance": {
    "contracts": [
      "docs/contracts/AAIS_SSP_PROTOCOL.md",
      "docs/contracts/AAIS_SSP_PROMOTION_PROTOCOL.md",
      "docs/contracts/AAIS_SUBSYSTEM_GENOME.md",
      "docs/contracts/AAIS_SUBSYSTEM_MUTATION_PATH.md",
      "docs/contracts/AAIS_SUBSYSTEM_RETIREMENT_PROTOCOL.md"
    ],
    "invariants": [
      "Read-only v1 \u2014 organ does not mutate upstream authority",
      "module_id frozen to AAIS-SPL-01"
    ]
  },
  "schema": {
    "ref": "schemas/speakers_lane_organ.v1.json",
    "frozen": true
  },
  "runtime": {
    "surface": [
      {
        "kind": "module",
        "path": "src/speakers_lane_organ.py"
      },
      {
        "kind": "api",
        "path": "GET /api/jarvis/speakers-lane/status"
      },
      {
        "kind": "gate",
        "path": "make speakers-lane-organ-gate"
      }
    ]
  },
  "proof": {
    "bundles": [
      "docs/proof/speakers/SPEAKERS_LANE_ORGAN_GOVERNED_PROOF.md"
    ],
    "posture": "governed",
    "target_bundles": [
      "docs/proof/speakers/SPEAKERS_LANE_ORGAN_V1_PROOF.md"
    ]
  },
  "lineage": {
    "parents": [
      "beatbox_lane_organ"
    ],
    "children": [
      "human_voice_extraction_organ"
    ]
  },
  "activation": {
    "order": 7,
    "batch_id": "alt13-summon-wave-2026-06",
    "notes": "Alt-13 wave 7"
  },
  "retirement": {
    "path": "docs/contracts/AAIS_SUBSYSTEM_RETIREMENT_PROTOCOL.md"
  },
  "mutation": {
    "history": []
  },
  "ssp": {
    "concept_spec": "docs/_future/ideas_pending/SPEAKERS_LANE_ORGAN.md",
    "mvp_plan": "docs/_future/ideas_pending/SPEAKERS_LANE_ORGAN_MVP_PLAN.md",
    "summon_eligible": false,
    "active_doc": "docs/subsystems/speakers/SPEAKERS_LANE_ORGAN.md",
    "engineering_class": "SpeakersLaneInterface",
    "mythic_label": "Speakers Lane Organ",
    "linguistic_version": "1.0.0"
  }
}
