{
  "subsystem_genome_version": "subsystem_genome.v1",
  "identity": {
    "gene": "document_vision_organ",
    "version": "0.1.0-concept",
    "stage": "governed",
    "display_name": "Document Vision Organ"
  },
  "governance": {
    "contracts": [
      "docs/contracts/AAIS_SSP_PROTOCOL.md",
      "docs/contracts/AAIS_SSP_PROMOTION_PROTOCOL.md",
      "docs/contracts/AAIS_SUBSYSTEM_GENOME.md",
      "docs/contracts/AAIS_SUBSYSTEM_MUTATION_PATH.md",
      "docs/contracts/AAIS_SUBSYSTEM_RETIREMENT_PROTOCOL.md"
    ],
    "invariants": [
      "Read-only v1 \u2014 organ does not mutate upstream authority",
      "module_id frozen to AAIS-DVO-01"
    ]
  },
  "schema": {
    "ref": "schemas/document_vision_organ.v1.json",
    "frozen": true
  },
  "runtime": {
    "surface": [
      {
        "kind": "module",
        "path": "src/document_vision_organ.py"
      },
      {
        "kind": "api",
        "path": "GET /api/jarvis/document-vision/status"
      },
      {
        "kind": "gate",
        "path": "make document-vision-organ-gate"
      }
    ]
  },
  "proof": {
    "bundles": [
      "docs/proof/platform/DOCUMENT_VISION_ORGAN_V1_PROOF.md"
    ],
    "posture": "governed",
    "target_bundles": [
      "docs/proof/platform/DOCUMENT_VISION_ORGAN_V1_PROOF.md"
    ]
  },
  "lineage": {
    "parents": [
      "capability_service_bridge",
      "narrative_trust_pack_organ"
    ],
    "children": [
      "ui_vision_organ"
    ]
  },
  "activation": {
    "order": 1,
    "batch_id": "alt14-summon-wave-2026-06",
    "notes": "Alt-14 wave 1"
  },
  "retirement": {
    "path": "docs/contracts/AAIS_SUBSYSTEM_RETIREMENT_PROTOCOL.md"
  },
  "mutation": {
    "history": []
  },
  "ssp": {
    "concept_spec": "docs/_future/ideas_pending/DOCUMENT_VISION_ORGAN.md",
    "mvp_plan": "docs/_future/ideas_pending/DOCUMENT_VISION_ORGAN_MVP_PLAN.md",
    "summon_eligible": false,
    "active_doc": "docs/subsystems/platform/DOCUMENT_VISION_ORGAN.md",
    "engineering_class": "DocumentVisionEngine",
    "mythic_label": "Document Vision Organ",
    "linguistic_version": "1.0.0"
  }
}
