{
  "subsystem_genome_version": "subsystem_genome.v1",
  "identity": {
    "gene": "otem_bounded_organ",
    "version": "0.1.0-concept",
    "stage": "governed",
    "display_name": "OTEM Bounded Organ"
  },
  "governance": {
    "contracts": [
      "docs/contracts/AAIS_SSP_PROTOCOL.md",
      "docs/contracts/AAIS_SSP_PROMOTION_PROTOCOL.md",
      "docs/contracts/AAIS_SUBSYSTEM_GENOME.md",
      "docs/contracts/AAIS_SUBSYSTEM_MUTATION_PATH.md",
      "docs/contracts/AAIS_SUBSYSTEM_RETIREMENT_PROTOCOL.md"
    ],
    "invariants": [
      "Read-only v1 \u2014 organ does not mutate upstream authority",
      "module_id frozen to AAIS-OTEM-01"
    ]
  },
  "schema": {
    "ref": "schemas/otem_bounded_organ.v1.json",
    "frozen": true
  },
  "runtime": {
    "surface": [
      {
        "kind": "module",
        "path": "src/otem_bounded_organ.py"
      },
      {
        "kind": "api",
        "path": "GET /api/jarvis/otem-bounded/status"
      },
      {
        "kind": "gate",
        "path": "make otem-bounded-organ-gate"
      }
    ]
  },
  "proof": {
    "bundles": [
      "docs/proof/platform/OTEM_BOUNDED_ORGAN_GOVERNED_PROOF.md"
    ],
    "posture": "governed",
    "target_bundles": [
      "docs/proof/platform/OTEM_BOUNDED_ORGAN_V1_PROOF.md"
    ]
  },
  "lineage": {
    "parents": [
      "cognitive_bridge_organ",
      "safety_envelope_organ",
      "operator_profile_organ"
    ],
    "children": [
      "direct_challenge_organ"
    ]
  },
  "activation": {
    "order": 1,
    "batch_id": "alt12-summon-wave-2026-06",
    "notes": "Alt-12 wave 1"
  },
  "retirement": {
    "path": "docs/contracts/AAIS_SUBSYSTEM_RETIREMENT_PROTOCOL.md"
  },
  "mutation": {
    "history": []
  },
  "ssp": {
    "concept_spec": "docs/_future/ideas_pending/OTEM_BOUNDED_ORGAN.md",
    "mvp_plan": "docs/_future/ideas_pending/OTEM_BOUNDED_ORGAN_MVP_PLAN.md",
    "summon_eligible": false,
    "active_doc": "docs/subsystems/platform/OTEM_BOUNDED_ORGAN.md",
    "engineering_class": "OtemBoundedEngine",
    "mythic_label": "Otem Bounded Organ",
    "linguistic_version": "1.0.0"
  }
}
