{
  "subsystem_genome_version": "subsystem_genome.v1",
  "identity": {
    "gene": "change_scope_organ",
    "version": "0.1.0-concept",
    "stage": "governed",
    "display_name": "Change Scope Organ"
  },
  "governance": {
    "contracts": [
      "docs/contracts/AAIS_SSP_PROTOCOL.md",
      "docs/contracts/AAIS_SSP_PROMOTION_PROTOCOL.md",
      "docs/contracts/AAIS_SUBSYSTEM_GENOME.md",
      "docs/contracts/AAIS_SUBSYSTEM_MUTATION_PATH.md",
      "docs/contracts/AAIS_SUBSYSTEM_RETIREMENT_PROTOCOL.md"
    ],
    "invariants": [
      "Read-only v1 \u2014 organ does not mutate upstream authority",
      "module_id frozen to AAIS-CS-01"
    ]
  },
  "schema": {
    "ref": "schemas/change_scope_organ.v1.json",
    "frozen": true
  },
  "runtime": {
    "surface": [
      {
        "kind": "module",
        "path": "src/change_scope_organ.py"
      },
      {
        "kind": "api",
        "path": "GET /api/jarvis/change-scope/status"
      },
      {
        "kind": "gate",
        "path": "make change-scope-organ-gate"
      }
    ]
  },
  "proof": {
    "bundles": [
      "docs/proof/platform/CHANGE_SCOPE_ORGAN_GOVERNED_PROOF.md"
    ],
    "posture": "governed",
    "target_bundles": [
      "docs/proof/platform/CHANGE_SCOPE_ORGAN_V1_PROOF.md"
    ]
  },
  "lineage": {
    "parents": [
      "patchforge_organ",
      "coding_organs_stack"
    ],
    "children": [
      "operator_workbench_organ",
      "patch_apply_organ",
      "patch_verification_organ"
    ]
  },
  "activation": {
    "order": 8,
    "batch_id": "alt11-summon-wave-2026-06",
    "notes": "Alt-11 wave 8"
  },
  "retirement": {
    "path": "docs/contracts/AAIS_SUBSYSTEM_RETIREMENT_PROTOCOL.md"
  },
  "mutation": {
    "history": []
  },
  "ssp": {
    "concept_spec": "docs/_future/ideas_pending/CHANGE_SCOPE_ORGAN.md",
    "mvp_plan": "docs/_future/ideas_pending/CHANGE_SCOPE_ORGAN_MVP_PLAN.md",
    "summon_eligible": false,
    "active_doc": "docs/subsystems/platform/CHANGE_SCOPE_ORGAN.md",
    "engineering_class": "ChangeScopeEngine",
    "mythic_label": "Change Scope Organ",
    "linguistic_version": "1.0.0"
  }
}
