{
  "subsystem_genome_version": "subsystem_genome.v1",
  "identity": {
    "gene": "workflow_shell_organ",
    "version": "0.1.0-concept",
    "stage": "governed",
    "display_name": "Workflow Shell Organ"
  },
  "governance": {
    "contracts": [
      "docs/contracts/AAIS_SSP_PROTOCOL.md",
      "docs/contracts/AAIS_SSP_PROMOTION_PROTOCOL.md",
      "docs/contracts/AAIS_SUBSYSTEM_GENOME.md",
      "docs/runtime/AAIS_RUNTIME_GUIDE.md",
      "docs/contracts/AAIS_SUBSYSTEM_MUTATION_PATH.md",
      "docs/contracts/AAIS_SUBSYSTEM_RETIREMENT_PROTOCOL.md"
    ],
    "invariants": [
      "Read-only v1 \u2014 organ does not mutate upstream authority",
      "module_id frozen to AAIS-WSO-01"
    ]
  },
  "schema": {
    "ref": "schemas/workflow_shell_organ.v1.json",
    "frozen": true
  },
  "runtime": {
    "surface": [
      {
        "kind": "module",
        "path": "src/workflow_shell_organ.py"
      },
      {
        "kind": "api",
        "path": "GET /api/jarvis/workflow-shell/status"
      },
      {
        "kind": "gate",
        "path": "make workflow-shell-organ-gate"
      }
    ]
  },
  "proof": {
    "bundles": [
      "docs/proof/platform/WORKFLOW_SHELL_ORGAN_GOVERNED_PROOF.md"
    ],
    "posture": "governed",
    "target_bundles": [
      "docs/proof/platform/WORKFLOW_SHELL_ORGAN_V1_PROOF.md"
    ]
  },
  "lineage": {
    "parents": [
      "operator_workbench_organ",
      "capability_service_bridge"
    ],
    "children": [
      "jarvis_operator_organ",
      "launcher_organ",
      "workflow_runtime_organ"
    ]
  },
  "activation": {
    "order": 9,
    "batch_id": "alt16-summon-wave-2026-06",
    "notes": "Alt-16 wave 9"
  },
  "retirement": {
    "path": "docs/contracts/AAIS_SUBSYSTEM_RETIREMENT_PROTOCOL.md"
  },
  "mutation": {
    "history": []
  },
  "ssp": {
    "concept_spec": "docs/_future/ideas_pending/WORKFLOW_SHELL_ORGAN.md",
    "mvp_plan": "docs/_future/ideas_pending/WORKFLOW_SHELL_ORGAN_MVP_PLAN.md",
    "summon_eligible": false,
    "active_doc": "docs/subsystems/platform/WORKFLOW_SHELL_ORGAN.md"
  }
}
