{
  "subsystem_genome_version": "subsystem_genome.v1",
  "identity": {
    "gene": "specialist_route_organ",
    "version": "0.1.0-concept",
    "stage": "governed",
    "display_name": "Specialist Route Organ"
  },
  "governance": {
    "contracts": [
      "docs/contracts/AAIS_SSP_PROTOCOL.md",
      "docs/contracts/AAIS_SSP_PROMOTION_PROTOCOL.md",
      "docs/contracts/AAIS_SUBSYSTEM_GENOME.md",
      "docs/contracts/AAIS_SUBSYSTEM_MUTATION_PATH.md",
      "docs/contracts/AAIS_SUBSYSTEM_RETIREMENT_PROTOCOL.md"
    ],
    "invariants": [
      "Read-only v1 \u2014 organ does not mutate upstream authority",
      "module_id frozen to AAIS-SRO-02"
    ]
  },
  "schema": {
    "ref": "schemas/specialist_route_organ.v1.json",
    "frozen": true
  },
  "runtime": {
    "surface": [
      {
        "kind": "module",
        "path": "src/specialist_route_organ.py"
      },
      {
        "kind": "api",
        "path": "GET /api/jarvis/specialist-route/status"
      },
      {
        "kind": "gate",
        "path": "make specialist-route-organ-gate"
      }
    ]
  },
  "proof": {
    "bundles": [
      "docs/proof/platform/SPECIALIST_ROUTE_ORGAN_GOVERNED_PROOF.md"
    ],
    "posture": "governed",
    "target_bundles": [
      "docs/proof/platform/SPECIALIST_ROUTE_ORGAN_V1_PROOF.md"
    ]
  },
  "lineage": {
    "parents": [
      "route_choice_organ"
    ],
    "children": [
      "provider_route_organ"
    ]
  },
  "activation": {
    "order": 8,
    "batch_id": "alt14-summon-wave-2026-06",
    "notes": "Alt-14 wave 8"
  },
  "retirement": {
    "path": "docs/contracts/AAIS_SUBSYSTEM_RETIREMENT_PROTOCOL.md"
  },
  "mutation": {
    "history": []
  },
  "ssp": {
    "concept_spec": "docs/_future/ideas_pending/SPECIALIST_ROUTE_ORGAN.md",
    "mvp_plan": "docs/_future/ideas_pending/SPECIALIST_ROUTE_ORGAN_MVP_PLAN.md",
    "summon_eligible": false,
    "active_doc": "docs/subsystems/platform/SPECIALIST_ROUTE_ORGAN.md",
    "engineering_class": "SpecialistRouteInterface",
    "mythic_label": "Specialist Route Organ",
    "linguistic_version": "1.0.0"
  }
}
